{
  "version_esquema": "ForensicDetection_v1",
  "caso_id": "CASE_20260224_TALO",
  "fecha_corte": "2026-02-24",
  "ticker": "TALO",
  "red_flags": [
    {
      "categoria": "ASSET_IMPAIRMENT",
      "riesgo": "Deterioro significativo de activos en periodos recientes",
      "evidencia_cuantitativa": "Cargos por impairment de $284M reportados en 9M-2025 (acumulado) y $223M en Q2-2025.",
      "ubicacion": "Income Statement 9M-2025 / Q2-2025",
      "source_id": "SRC_SEC_007_10-Q_Q3-2025",
      "interpretacion": "Indica posible sobrevaloración de activos adquiridos previamente (ej. adquisiciones EnVen/QuarterNorth) o revisión a la baja de reservas recuperables. Señal de destrucción de valor en el balance."
    },
    {
      "categoria": "EARNINGS_QUALITY",
      "riesgo": "Divergencia extrema entre Beneficio Neto y Flujo de Caja Operativo",
      "evidencia_cuantitativa": "En 9M-2025, Net Income es -$292M mientras CFO es +$734M. En FY2024, Net Income -$76M vs CFO +$963M.",
      "ubicacion": "Cash Flow Statement vs Income Statement FY2024 & 9M-2025",
      "source_id": "SRC_SEC_001_10-K_FY2024",
      "interpretacion": "La rentabilidad contable es consistentemente negativa debido a cargas masivas no monetarias (DD&A $813M en 9M-2025). Aunque el flujo de caja es positivo, la incapacidad de generar beneficios netos plantea dudas sobre la cobertura real del costo de capital y reposición de reservas a largo plazo."
    },
    {
      "categoria": "DEBT_STRUCTURE",
      "riesgo": "Apalancamiento elevado frente a EBIT negativo",
      "evidencia_cuantitativa": "Deuda Total ~$1.22B (Q3-2025) con EBIT acumulado negativo (-$316M en 9M-2025) y EBIT anual FY2024 bajo ($173M).",
      "ubicacion": "Balance Sheet Q3-2025",
      "source_id": "SRC_SEC_007_10-Q_Q3-2025",
      "interpretacion": "La cobertura de intereses basada en EBIT es inexistente (< 1.0x o negativa). La empresa depende enteramente del EBITDA/CFO para servicio de deuda. Sensibilidad extrema a caídas en precios de commodities."
    },
    {
      "categoria": "COST_STRUCTURE",
      "riesgo": "Estructura de costos fijos/operativos creciente",
      "evidencia_cuantitativa": "Depreciation, Depletion & Amortization (DD&A) aumentó a ~$1.02B en FY2024 vs ~$663M en FY2023.",
      "ubicacion": "Income Statement FY2024",
      "source_id": "SRC_SEC_001_10-K_FY2024",
      "interpretacion": "El aumento desproporcionado en DD&A presiona los márgenes operativos. Puede reflejar una base de activos más cara de operar o tasas de declive de producción aceleradas."
    }
  ],
  "liquidez": {
    "caja_disponible_usd": 108172000,
    "caja_fuente": "Balance Sheet FY2024 (audited). Notas indican caja restringida adicional no incluida en este total.",
    "deuda_total_usd": 1224947000,
    "deuda_fuente": "Balance Sheet Q3-2025 (Long-Term Debt)",
    "vencimientos_clave": [
      {
        "descripcion": "Senior Notes 2026",
        "fecha_estimada": "2026",
        "monto_usd": 638541000,
        "fuente": "Contractual Obligations Table (Log Reference)",
        "riesgo": "ALTO - Vencimiento inminente si no ha sido refinanciado (fecha actual Feb 2026)."
      },
      {
        "descripcion": "Credit Facility (RBL)",
        "fecha_estimada": "2030-01-20",
        "monto_usd": null,
        "fuente": "8-K 2026-01-21",
        "riesgo": "BAJO - Recientemente extendido y reafirmado ($700M base)."
      }
    ],
    "runway_estimado_meses": "24+",
    "estado_liquidez": "ESTABLE_CON_RIESGO_REFINANCIAMIENTO",
    "analisis_liquidez": "La empresa genera FCF positivo ($372M en 9M-2025, $454M en FY2024) lo que cubre sus necesidades operativas y de capex actuales. La liquidez inmediata depende de la disponibilidad de la línea RBL ($700M base) y la caja en balance. El riesgo principal es el muro de vencimientos de bonos 2026; si no se refinancian, la liquidez se vería comprometida inmediatamente."
  },
  "puentes": {
    "ebit_cfo_fy2024": {
      "ebit_usd": 172925000,
      "cfo_usd": 962593000,
      "variacion_usd": 789668000,
      "variacion_pct": 456.6,
      "explicacion": "Diferencia masiva explicada principalmente por DD&A ($1,023M) sumado al Net Loss para llegar al CFO. El EBIT incluye cargos por depreciación que no son salida de caja.",
      "componentes_clave": [
        {
          "nombre": "Depreciation & Amortization",
          "valor_usd": 1023558000
        },
        {
          "nombre": "Interest & Taxes (implied cash vs accrual)",
          "valor_usd": -233890000
        }
      ]
    },
    "cfo_fcf_fy2024": {
      "cfo_usd": 962593000,
      "fcf_usd": 453679000,
      "capex_usd": -508914000,
      "conversion_rate_pct": 47.1,
      "explicacion": "Conversión saludable de CFO a FCF (~47%). Capex representa ~53% del flujo operativo, típico para mantenimiento y desarrollo en E&P offshore.",
      "ajustes_adicionales": []
    },
    "ebit_cfo_9m2025": {
      "ebit_usd": -316322000,
      "cfo_usd": 734046000,
      "variacion_usd": 1050368000,
      "variacion_pct": null,
      "explicacion": "Inversión de signo: Pérdida operativa contable masiva transformada en caja operativa positiva gracias a DD&A ($813M) e Impairments ($284M)."
    }
  },
  "kill_criteria_candidatos": [
    {
      "criterio": "Fallo en Refinanciamiento Senior Notes 2026",
      "umbral": "Incapacidad de extender/pagar bonos al vencimiento en 2026",
      "ventana_observacion": "Inmediata (< 6 meses)",
      "probabilidad": "MEDIA",
      "impacto": "LIQUIDACIÓN / REESTRUCTURACIÓN"
    },
    {
      "criterio": "Caída sostenida de Precios WTI",
      "umbral": "WTI < $55/bbl por > 2 trimestres consecutivos",
      "ventana_observacion": "12 meses",
      "probabilidad": "MEDIA",
      "impacto": "CASH BURN (FCF negativo por alto capex fijo offshore)"
    },
    {
      "criterio": "Declive Acelerado de Producción",
      "umbral": "Producción < 85 kboe/d sin reducción proporcional de Capex",
      "ventana_observacion": "12-18 meses",
      "probabilidad": "BAJA",
      "impacto": "INSOLVENCIA (Inviabilidad de estructura de capital)"
    },
    {
      "criterio": "Recorte de Borrowing Base",
      "umbral": "Reducción de base prestable < $500M en próxima redeterminación",
      "ventana_observacion": "Próxima revisión (Semestral)",
      "probabilidad": "BAJA",
      "impacto": "CRISIS DE LIQUIDEZ"
    }
  ],
  "report_type": "Forensic_Analysis",
  "input_refs": {
    "truth_pack": "TruthPack_v1",
    "implied_expectations": "ImpliedExpectations_v1"
  },
  "log": {
    "analisis_realizado": "Revisión completa de estados financieros anuales y trimestrales. Enfoque en discrepancias accrual vs cash.",
    "limitaciones": "Falta detalle de deuda (current vs long term) en Balance Sheet FY2024 para confirmar fecha exacta de vencimiento de bonos 2026. Se asume riesgo inminente por fecha actual (Feb 2026)."
  }
}